<?xml version="1.0"?>
<config xmlns:xsi="http://www.w3.org/2001/XMLSchema-instance" xsi:noNamespaceSchemaLocation="urn:magento:module:Firegento_ContentProvisioning:etc/content_provisioning.xsd">
    <page key="test.page.1" identifier="test-page-1" maintained="true" active="true">
        <title>Test Page 1</title>
        <content type="file">Firegento_ContentProvisioning::Test/Integration/Model/Config/_files/test-files/file-1.html</content>
    </page>
    <page key="test.page.2" identifier="test-page-2" active="false">
        <title>Title 2</title>
        <content heading="New Page Heading 2" type="file">Firegento_ContentProvisioning::Test/Integration/Model/Config/_files/test-files/file-1.html</content>
        <stores>
            <store code="default"/>
            <store code="admin"/>
        </stores>
        <seo>
            <title>SEO Page Title</title>
            <keywords>Some, SEO, keywords</keywords>
            <description>SEO description</description>
        </seo>
        <design>
            <layout>3columns</layout>
            <layout_xml><![CDATA[<foo>bar</foo>]]></layout_xml>
        </design>
        <custom_design>
            <from>2019-03-03</from>
            <to>2019-03-29</to>
            <layout>3columns</layout>
            <theme_id>3</theme_id>
        </custom_design>
    </page>
    <page key="test.page.3" identifier="test-page-3" active="true" maintained="true">
        <title>Page With Images</title>
        <content type="file">Firegento_ContentProvisioning::Test/Integration/Model/Config/_files/test-files/content-with-images-1.html</content>
        <media_directory>Firegento_ContentProvisioning::Test/Integration/Model/Config/_files/test-files/media</media_directory>
    </page>
    <block key="test.block.1" identifier="test-block-1" maintained="true" active="true">
        <title>Test Block 1</title>
        <content><![CDATA[<h2>test foobar Aenean commodo ligula eget dolor aenean massa</h2>]]></content>
    </block>
    <block key="test.block.2" identifier="test-block-2" maintained="false" active="true">
        <title>Test Block 2</title>
        <content type="file">Firegento_ContentProvisioning::Test/Integration/Model/Config/_files/test-files/file-1.html</content>
        <stores>
            <store code="default"/>
            <store code="admin"/>
        </stores>
    </block>
    <block key="test.block.3" identifier="test-block-3" maintained="true" active="true">
        <title>Block With Images</title>
        <content type="file">Firegento_ContentProvisioning::Test/Integration/Model/Config/_files/test-files/content-with-images-1.html</content>
        <media_directory>Firegento_ContentProvisioning::Test/Integration/Model/Config/_files/test-files/media</media_directory>
    </block>
</config>
